title,arist,lyrics
Psalm 103,JPCC Worship,"My whole heart
My whole life
Bow in wonder of Your love
How could I ever forget
Your grace is miracle to me

I boast nothing but my Christ
Not my power
Not my wisdom
I will trust You with my heart
I will wait here
In Your presence

Whom have I in heaven
I desire none but You
Though my flesh, they may fail
My portion You are all I need

I boast nothing but my Christ
Not my power
Not my wisdom
I will trust You with my heart
I will wait here
In Your presence

Your greatness, Your power
Your love is washing over me
Amazing Your grace is
Now I know that I am free

Your greatness, Your power
Your love is washing over me
Amazing Your grace is
Now I know that I am free

I've seen Your greatness, seen Your power, love
Your love's amazing, now that I am free

Your greatness, Your power
Your love is washing over me
Amazing Your grace is
Now I know that I am free

Your greatness, Your power
Your love is washing over me
Amazing Your grace is
Now I know that I am free

Your love's amazing, now that I am free"
none,none,none
I Like Me Better,Ysabelle Cuevas,"To be young and in love in New York City
To not know who I am but still know that I'm good long as you're here with me
To be drunk and in love in New York City
Midnight into morning coffee
Burning through the hours talking

I like me better when I'm with you
I like me better when I'm with you
I knew from the first time, I'd stay for a long time
'Cause I like me better when
I like me better when I'm with you

I don't know what it is but I got that feeling
Waking up in this bed next to you, swear the room yeah it got no ceiling
If we lay, let the day just pass us by
I might get to too much talking, I might have to tell you something

I like me better when I'm with you
I like me better when I'm with you
I knew from the first time, I'd stay for a long time
'Cause I like me better when
I like me better when I'm with you

Stay awhile stay awhile
Stay here with me
Stay awhile stay awhile, oh
Stay awhile stay awhile
Stay here with me
Lay here with me
Yeah, yeah

I like me better when I'm with you
(Yes, I do, yes, I do, baby)
I like me better when I'm with you
I knew from the first time
I'd stay for a long time
'Cause I like me better when
I like me better when I'm with you

I like me, I like me
Look who you made me, baby, oh no
I like me better when I'm with you"
Hottest In Tha City,Meek Mill,"[Hook: x2]
Hottest In The City [x4]
Ain't no body gonna top

[Verse:]
Meek Milly I'm flammin
Hotter den da whip I came in, harder den da pavement
Droppin on dese niggas back to back I'm rainmaker
'Cause you the top noodle like Raymond[save it]
Boss Ricky Ross, stand tall City Hall
I'm the hottest in the city got dem rida niggas with me
When they let me out the cell I was bobbin like I'm Diddy
Den Omelly came to scoop with da choppa in his fizzy {like}
Like what it is, what's really good
I be anywhere, any block, any hood
All my niggas ride hard like a inny should
I be beastin these rap niggas like a skinny should
In yo area puffy on scovo, I jus wanna make a little change OBAMA
Me and Osama co-45ers get the bustin I ain't talkin yo mama {Nigga m the}

[Hook]

It's Philly Mill, is he really real?
Hold up, let me tell dese niggas how I really feel
Bitch nigga come home for a stripe, start dissin niggas on a tape {fuck outta here}
Shout out to G-Raw, shout out to nigga Vok, shout out to black Neil real niggas on top
I'm on my different sht, can't stop won't stop
Send Omelly out with 30 and he ain't gon stop
He gonna do you niggas dirty like a floor mop
Hit you on the first row of bull shots, more shots
Heard about your little diss, you ain't drop
The mix tapes real niggas who ain't cop it
My bag oh ain't I, I'm in my bag oh ain't I
40 on my hip, one up in the chamber
30 in the clit, walk up like a stranger
You with all of dat, dey be like dats a flamer {'Cause I'm da}

[Hook]

I spit flame, Luke Kane yea I finished him
I give it to em niggas raw like Dominicans[yea]
Hater, I got plenty dem but like Arsenial, I semmie dem really tho
Will is blue, fuck a nigga ass like Omelio, Niggas say I'm sick but I'm illy tho
I be on some shit behind prints till something hit me with a pretty hoe
Be on the southside but in North Philly tho, really tho
Bird by the pound, but crack by the o-z, I'm so fly all your hoes know me
Me, Oski, Haddy dropped the matix tough, hittin bitches like the batter up, you mad at dem
We gettin paper, hater how you made it? forty-orty, jump all on it we gettin major
Young player, more like Kobe play for the Lakers, with cavali Pardas in multi-color flavors

[Hook: till end]"
The Night We Met,Lord Huron,"I am not the only traveler
Who has not repaid his debt
I've been searching for a trail to follow again
Take me back to the night we met

And then I can tell myself
What the hell I'm supposed to do
And then I can tell myself
Not to ride along with you

I had all and then most of you
Some and now none of you
Take me back to the night we met
I don't know what I'm supposed to do
Haunted by the ghost of you
Take me back to the night we met

When the night was full of terrors
And your eyes were filled with tears
When you had not touched me yet
Oh, take me back to the night we met

I had all and then most of you
Some and now none of you
Take me back to the night we met
I don't know what I'm supposed to do
Haunted by the ghost of you
Take me back to the night we met"
Do It Again (Acoustic),Elevation Worship,"Walking around these walls
I thought by now they'd fall
But You have never failed me yet

Waiting for change to come
Knowing the battle's won
For You have never failed me yet

Your promise still stands
Great is Your faithfulness, faithfulness
I'm still in Your hands
This is my confidence, You've never failed me yet

I know the night won't last
Your Word will come to pass
My heart will sing Your praise again

Jesus You're still enough
Keep me within Your love
My heart will sing Your praise again

Your promise still stands
Great is Your faithfulness, faithfulness
I'm still in Your hands
This is my confidence, You never failed

Your promise still stands
Great is Your faithfulness, faithfulness
I'm still in Your hands
This is my confidence, You never failed me yet

I've seen You move... come move the mountains
And I believe... I'll see You do it again
You made a way... where there was no way
And I believe... I'll see You do it again

I've seen You move... come move the mountains
And I believe... I'll see You do it again
You made a way... where there was no way
And I believe... I'll see You do it again

I've seen You move... come move the mountains
And I believe... I'll see You do it again
You made a way... where there was no way
And I believe... I'll see You do it again
I'll see You do it again...

Your promise still stands
Great is Your faithfulness, faithfulness
I'm still in Your hands
This is my confidence, You never failed

Your promise still stands
Great is Your faithfulness, faithfulness
I'm still in Your hands
This is my confidence, You never failed me yet

Oh You never failed me yet
I never will forget
'Cause You never failed me yet
I never will forget..."
No Other Name,Hillsong Worship,"One name
Holds weight above them all
His fame
Outlasts the earth He formed
His praise
Resounds beyond the stars
And echoes in our hearts
The greatest One of all

His face
Shines brighter than the sun
His grace
As boundless as His love
He reigns
With healing in His wings
The King above all kings
The greatest One of all

Lift up our eyes, see the King has come
Light of the world reaching out for us
There is no other name
There is no other name
Jesus Christ our God

Seated on high, the undefeated One
Mountains bow down as we lift Him up
There is no other name
There is no other name
Jesus Christ our God

Find hope
When all the world seems lost
Behold
The triumph of the cross
His power
Has trampled death and grave
Our life found in His name
The greatest name of all

Lift up our eyes, see the King has come
Light of the world reaching out for us
There is no other name
There is no other name
Jesus Christ our God

Seated on high, the undefeated One
Mountains bow down as we lift Him up
There is no other name
There is no other name
Jesus Christ our God
Jesus

The earth will shake
And tremble before Him
Chains will break
As heaven and earth sing
Holy is the name
Holy is the name of
Jesus, Jesus, Jesus
[x2]

Lift up our eyes, see the King has come
Light of the world reaching out for us
There is no other name
There is no other name
Jesus Christ our God

Seated on high, the undefeated One
Mountains bow down as we lift Him up
There is no other name
There is no other name
There is no other name
There is no other name
Jesus"
Devotion,Hillsong United,"I've been running, trying to be one who sees
I've been working, salvation out on my knees
There is nothing better than knowing
We are redeemed
I'm believing, trusting in Creative Hands,
I am praying for our world to bow to Your Plan
And this one thought is unmistakable
To take up my cross and follow You, Lord

When You stand, the tall tress and mountains bow
When You speak, the fiercest of oceans is still
And I see the sinner seek devotion
The lost become chosen, and I fall to my knees

I'm forgiven by a Saviour who did not deserve death
He was blameless and I was lost in shamefulness
I'm delivered, but it doesn't seem right
Unless I keep my eyes focused on the Saviour who gave His life
In the middle of a world that denies it believes
It is breaking apart at the very seams
There is one thing to be alive for
And it's to take up my cross and follow You, Lord

When You stand, the tall trees and mountains bow
When You speak, the fiercest of oceans is still
And I see the sinner seek devotion
The lost become chosen, and I fall to my knees

I will take up my cross and follow, Lord where You lead me
And I will take up my cross and follow wherever You go

When You stand, the tall trees and mountains bow
When You speak, the fiercest of oceans is still
And I see the sinner seek devotion
The lost become chosen, and I fall to my knees

Fall to my knees"
