title,arist,lyrics
Wouldn't Mean A Thing,Bruno Major,"I could climb the Himalayan mountains
Or the pyramids in West Peru
I could travel back in time and hear Al Green sing
It wouldn't mean a thing without you
I could sail across the Indian Ocean
And bathe in the reflection of the moon
I could find the buried treasure of ancient kings
But it wouldn't mean a thing without you
No, it wouldn't mean a thing without you

You bring out the best in me
Help me see the world differently
Be a better man than I'd ever be on my own
I'll give you the rest of me
You're the reason I rest easily
It's the love and loyalty you've shown

I could work hard, make a fortune
Bet it all on red only to lose
If money comes my way I won't be complaining
It wouldn't mean a thing without you
No, it wouldn't mean a thing without you

You bring out the best in me
Help me see the world differently
Be a better man than I'd ever be on my own
I'll give you the rest of me
You're the reason I rest easily
It's the love and loyalty you've shown

I could climb the Himalayan mountains
Or the pyramids in West Peru
I could travel back in time and hear Al Green sing
It wouldn't mean a thing with out you
No, it wouldn't mean a thing without you"
Death Of A Bachelor,NateWantsToBattle,"Do I look lonely?
I see the shadows on my face
People have told me
I don't look the same
Maybe I lost weight
I'm playing hooky
With the best of the best
Pull my heart out my chest
So that you can see it too

I'm walking the long road
Watching the sky fall
The lace in your dress
Tangles my neck
How do I live?

The death of a bachelor
Oh oh-oh
Letting the water fall
The death of a bachelor
Oh oh-oh
Seems so fitting for
Happily ever after
Whooo
How could I ask for more?
Lifetime of laughter
At the expense of the death of a bachelor

I'm cutting my mind off
Feels like my heart is going to burst
Alone at a table for two
And I just want to be served
And when you think of me
Am I the best you've ever had?
Share one more drink with me
Smile even though you're sad

I'm walking the long road
Watching the sky fall
The lace in your dress
Tangles my neck
How do I live?

The death of a bachelor
Oh oh-oh
Letting the water fall
The death of a bachelor
Oh oh-oh
Seems so fitting for
Happily ever after
Whooo
How could I ask for more?
Lifetime of laughter
At the expense of the death of a bachelor

The death of a bachelor
Oh oh-oh
Letting the water fall
The death of a bachelor
Oh oh-oh
Seems so fitting for
Happily ever after
Whooo
How could I ask for more?
Lifetime of laughter
At the expense of the death of a bachelor"
Who Says,John Mayer,"Who says I can’t get stoned?
Turn off the lights and the telephone
Me in my house alone
Who says I can’t get stoned?

Who says I can’t be free?
From all of the things that I used to be
Re-write my history
Who says I can’t be free?

It’s been a long night in New York City
It’s been a long night in Baton Rouge
I don’t remember you looking any better
But then again I don’t remember you

Who says I can’t get stoned?
Call up a girl that I used to know
Fake love for an hour or so
Who says I can’t get stoned?

Who says I can’t take time?
Meet all the girls on the county line
Wait on fate to send a sign
Who says I can’t take time?

It’s been a long night in New York City
It’s been a long night in Austin too
I don’t remember you looking any better
But then again I don’t remember you

Who says I can’t get stoned?
Plan a trip to Japan alone
Doesn’t matter if I even go
Who says I can’t get stoned?
Mmhmm

It’s been a long night in New York City
It’s been a long time since 22
I don’t remember you looking any better
But then again I don’t remember, don't remember you"
Another In The Fire,Hillsong United,"There's a grace when the heart is under fire
Another way when the walls are closing in
And when I look at the space between
Where I used to be and this reckoning
I know I will never be alone

There was another in the fire
Standing next to me
There was another in the waters
Holding back the seas
And should I ever need reminding
Of how I've been set free
There is a cross that bears the burden
Where another died for me

There is another in the fire

All my debt left for dead beneath the waters
I'm no longer a slave to my sin anymore
And should I fall in the space between
What remains of me and this reckoning
Either way I won't bow to the things of this world

'Cause I know

And I know I will never be alone

There is another in the fire
Standing next to me
There is another in the waters
Holding back the seas
And should I ever need reminding
What power set me free
There is a grave that holds no body
And now that power lives in me

There is another in the fire
There is another in the fire
There is another in the fire
There is another in the fire

I can see

And I can see the light in the darkness
As the darkness bows to Him
I can hear the roar in the heavens
As the space between wears thin

I can feel the ground shake beneath us
As the prison walls cave in
Nothing stands between us
Nothing stands between us

And there is no other name
But the name that is Jesus
He who was and still is
And will be through it all
So come what may in the space between
All the things unseen
And this reckoning
I know I will never be alone

I know. Come on
I know I will never be alone

There'll be another in the fire
Standing next to me
There'll be another in the waters
Holding back the seas
And should I ever need reminding
How good You've been to me
I'll count the joy come every battle
'Cause I know that's where You'll be

I can see the light

And I can see the light in the darkness
As the darkness bows to Him
I can hear the roar in the heavens
As the space between wears thin

I can feel the ground shake beneath us
As the prison walls cave in
Nothing stands between us
Nothing stands between

There'll be another in the fire
Standing next to me
There'll be another in the waters
Holding back the seas
And should I ever need reminding
How good You've been to me
I'll count the joy come every battle
'Cause I know that's where You'll be

Count the joy come every battle
'Cause I know that's where You'll be
Count the joy come every battle
'Cause I know that's where You'll be

Sing it again

I'll count the joy come every battle
'Cause I know that's where You'll be
I'll count the joy come every battle
'Cause I know that's where You'll be"
Hosanna,Hillsong United,"I see the King of glory
Coming on the clouds with fire
The whole earth shakes
The whole earth shakes

Yeah

I see His love and mercy
Washing over all our sin
The people sing
The people sing

[Chorus]
Hosanna
Hosanna
Hosanna in the highest [x2]

I see a generation
Rising up to take their place
With selfless faith
With selfless faith

I see a near revival
Stirring as we pray and seek
We're on our knees
We're on our knees

[Chorus]

Heal my heart and make it clean
Open up my eyes to the things unseen
Show me how to love like You have loved me

Break my heart for what breaks Yours
Everything I am for Your kingdom's cause
As I walk from earth into eternity

[Chorus x2]

Hosanna in the highest"
As You Find Me,Hillsong United,"I've been strong and I've been broken within a moment
I've been faithful and I've been reckless at every bend
I've held everything together and watched it shatter
I've stood tall and I have crumbled in the same breath

I have wrestled and I have trembled toward surrender
Chased my heart adrift and drifted home again
Plundered blessing till I've been desperate to find redemption
And every time I turn around Lord You're still there

I was found before I was lost
I was Yours before I was not
Grace to spare for all my mistakes
And that part just wrecks me

And I know I
I don't deserve this kind of love
Somehow
This kind of love is who You are
It's a grace I could never add up
To be somebody You still want
Somehow
You love me as You find me

Who am I to think Your glory needs my praises
But if this borrowed breath is Yours Lord take it all
You are faithful and You are gracious and I'm just grateful
To think you don't need a single thing and still You want my heart

I was found before I was lost
I was Yours before I was not
You wear the scars
And that part just wrecks me

And I know I
I don't deserve this kind of love
Somehow
This kind of love is who You are
It's a grace I could never add up
To be somebody You still want
Somehow
You love me as You find me
You love me as You find me
You love me as You find me
You love me as You find me

Your love's too good to leave me here (You love me as You find me)
Your love's too good to leave me here (You love me as You find me)
Your love's too good to leave me here (You love me as You find me)
Your love's too good to leave me here (You love me as You find me)
Your love's too good to leave me here
If you want my heart I won't second guess
Cause I need Your love more than anything
I'm in
I'm Yours
Your love's too good to leave me here
Your love's too good to leave me here
Your love's too good

And I know I
I don't deserve this kind of love
Somehow
This kind of love is who You are
It's a grace I could never add up
To be somebody You still want
Somehow
You love me as You find me
You love me as You find me
You love me as You find me"
Malibu Nights,LANY,"There's no reason, there's no rhyme
I found myself blindsided by
A feeling that I've never known
I'm dealing with it on my own

Phone is quiet, walls are bare
I drink myself to sleep. Who cares?
No one even has to know
I'm dealing with it on my own

I've got way too much time to be this hurt
Somebody, help. It's getting worse
What do you do with a broken heart?
Once the light fades, everything is dark

Way too much whiskey in my blood
I feel my body giving up
Can I hold on for another night?
What do I do with all this time?

Heavy thoughts, when it gets late
Put me in a fragile state
I wish I wasn't going home
Dealing with it on my own

I'm praying, but it's not enough
I'm done. I don't believe in love
Learning how to let it go
Dealing with it on my own

I've got way too much time to be this hurt
Somebody, help. It's getting worse
What do you do with a broken heart?
Once the light fades, everything is dark

Way too much whiskey in my blood
I feel my body giving up
Can I hold on for another night?
What do I do with all this time?
Yeah

I drive circles under street lights
Nothing seems to clear my mind
I can't forget
If it's inside my head
So, I drive chasing Malibu nights
Nothing seems to heal my mind
I can't forget

I've got way too much time to be this hurt
Somebody, help. It's getting worse
What do you do with a broken heart?
Once the light fades, everything is dark

Way too much whiskey in my blood
I feel my body giving up
Can I hold on for another night?
What do I do with all this time?
Yeah

I drive circles under street lights
Nothing seems to clear my mind
I can't forget
If it's inside my head
So, I drive chasing Malibu nights
Nothing seems to heal my mind
I can't forget
If it's inside my head

So, I drive chasing Malibu nights
Nothing seems to heal my mind"
The 1975,The 1975,"We are right now in the beginning of a climate and ecological crisis, and we need to call it what it is: an emergency. We must acknowledge that we do not have the situation under control, and that we don't have all the solutions yet; unless those solutions mean that we simply stop doing certain things. We must admit that we are losing this battle. We have to acknowledge that the older generations have failed. All political movements in their present form have failed, but Homo sapiens have not yet failed. Yes, we are failing, but there is still time to turn everything around. We can still fix this. We still have everything in our own hands, but unless we recognise the overall failures of our current systems, we most probably don't stand a chance.

We are facing a disaster of unspoken sufferings for enormous amounts of people, and now is not the time for speaking politely or focusing on what we can or cannot say. Now is the time to speak clearly. Solving the climate crisis is the greatest and most complex challenge that Homo sapiens have ever faced. The main solution, however, is so simple that even a small child can understand it: we have to stop our emissions of greenhouse gases, and either we do that, or we don't. You say that nothing in life is black or white, but that is a lie, a very dangerous lie. Either we prevent a 1.5 degree of warming, or we don't; either we avoid setting off that irreversible chain reaction beyond human control, or we don't; either we choose to go on as a civilization, or we don't. That is as black or white as it gets because there are no grey areas when it comes to survival.

Now we all have a choice: we can create transformational action that will safeguard the living conditions for future generations, or we can continue with our business as usual and fail. That is up to you and me. And yes, we need a system change rather than individual change, but you cannot have one without the other. If you look through history, all the big changes in society have been started by people at the grassroots level—people like you and me. So, I ask you to please wake up and make the changes required possible. To do your best is no longer good enough. We must all do the seemingly impossible. Today, we use about 100 million barrels of oil every single day. There are no politics to change that; there are no rules to keep that oil in the ground. So, we can no longer save the world by playing by the rules, because the rules have to be changed. Everything needs to change, and it has to start today. So, everyone out there, it is now time for civil disobedience. It is time to rebel."
Highlands (Song Of Ascent),Hillsong United,"O how high would I climb mountains
If the mountains were where You hide
O how far I'd scale the valleys
If You graced the other side

O how long have I chased rivers
From lowly seas to where they rise
Against the rush of grace descending
From the source of its supply

Cause in the highlands and the heartache
You're neither more or less inclined
I would search and stop at nothing
You're just not that hard to find

Oh I will praise You on the mountain
And I will praise you when the mountain's in my way
You're the summit where my feet are
So I will praise You in the valleys all the same
No less God within the shadows
No less faithful when the night leads me astray
Cause You're the Heaven where my heart is
In the highlands and the heartache all the same

O how far beneath Your glory
Does Your kindness extend the path
From where your feet rest on the sunrise
To where You sweep the sinner's past

And though how fast would you come running
If just to shadow me through the night
Trace my steps through all my failures
And walk me out the other side

For who could dare ascend that mountain
That valleyed hill called Calvary
But for the One I call Good Shepherd
Who like a lamb was slain for me

Oh I will praise You on the mountain
And I will praise you when the mountain's in my way
You're the summit where my feet are
So I will praise You in the valleys all the same
No less God within the shadows
No less faithful when the night leads me astray
Cause You're the Heaven where my heart is
In the highlands and the heartache all the same

Sing it out

Whatever I walk through
Wherever I am
Your Name can move mountains
Wherever I stand
And if ever I walk through
The valley of death
I'll sing through the shadows
My song of ascent

Whatever I walk through
Wherever I am
Your Name can move mountains
Wherever I stand
And if ever I walk through
The valley of death
I'll sing through the shadows
My song of ascent
My song of ascent

Sing it out

My song of ascent

From the gravest of all valleys
Come the pastures we call grace
A mighty river flowing upwards
From a deep but empty grave

So I will praise You on the mountain
And I will praise you when the mountain's in my way
You're the summit where my feet are
Yes you are
So I will praise You in the valleys all the same
No less God within the shadows
No less faithful when the night leads me astray
You're the Heaven where my heart is
In the highlands and the heartache all the same"
Hosanna,Hillsong United,"I see the King of glory
Coming on the clouds with fire
The whole earth shakes
The whole earth shakes

Yeah

I see His love and mercy
Washing over all our sin
The people sing
The people sing

[Chorus]
Hosanna
Hosanna
Hosanna in the highest [x2]

I see a generation
Rising up to take their place
With selfless faith
With selfless faith

I see a near revival
Stirring as we pray and seek
We're on our knees
We're on our knees

[Chorus]

Heal my heart and make it clean
Open up my eyes to the things unseen
Show me how to love like You have loved me

Break my heart for what breaks Yours
Everything I am for Your kingdom's cause
As I walk from earth into eternity

[Chorus x2]

Hosanna in the highest"
Bad Guy,Billie Eilish & Justin Bieber,"White shirt now red, my bloody nose
Sleepin', you're on your tippy toes
Creepin' around like no one knows
Think you're so criminal
Bruises on both my knees for you
Don't say thank you or please
I do what I want when I'm wanting to
My soul so cynical

So you're a tough guy
Like it really rough guy
Just can't get enough guy
Chest always so puffed guy

I'm that bad type
Make your mama sad type
Make-your-girlfriend-mad type
Might seduce your dad type
I'm the bad guy (Duh)
I'm the bad guy

Gold teeth, my neck, my wrist is froze
(So icy)
I got more ice than, than the snow
That guy don't act like you don't know
That guy, so critical
Tattoos on both my sleeves, yeah I
Don't sleep, please don't wake me
Loosen my tie up, so I can breathe
It ain't political, oh no

Yeah I'm a bad guy
Ain't no holdin' back guy
Come off like a mad guy
Always got your back guy
Yeah I'm the real type
Keep you full of thrills type
Show you what it feels like
Got an open invite
I'm the bad guy, whoa (Duh)
I'm the bad guy (Duh)

I'm only good at being bad, bad

I like when you get mad
I guess I'm pretty glad that you're alone
(So icy)
You said she's scared of me?
I mean, I don't see what she sees
But maybe it's 'cause I'm wearing your cologne
(Let's go)

(I'm a bad guy)
(Damn right)
(I'm-I'm a bad guy)
(Oh yeah)
(I'm a—)"
Who You Say I Am (Live Acoustic),Hillsong Worship,"Who am I that the highest King
Would welcome me
I was lost but He brought me in
Oh His love for me

Who the Son sets free
Oh is free indeed
I'm a child of God
Yes I am

Free at last He has ransomed me
His grace runs deep
While I was a slave to sin
Jesus died for me
Yes He died for me

Who the Son sets free
Oh is free indeed
I'm a child of God
Yes I am
In my Father's house
There's a place for me
I'm a child of God
Yes I am

I am chosen, not forsaken
I am who You say I am
You are for me, not against me
I am who You say I am
I am chosen, not forsaken
I am who You say I am
You are for me, not against me
I am who You say I am
I am who You say I am

Who the Son sets free
Oh is free indeed
I'm a child of God
Yes I am
In my Father's house
There's a place for me
I'm a child of God
Yes I am
I'm a child of God
Yes I am"
Honestly (솔직히),Eric Nam,"[Romanized:]

Neol sarangeun hajiman jogeum jichingeoya
Sangcheoreul jugiga neomu duryeoungeoya
Chakhan ge anya nal wihae geureongeoya
Ajikdo neol saranghandaneun geojitmal

Neon dabeul wonhaetji shijakbuteo
Gyeolmareul miri bon yeonghwacheoreom
Budamseureowotji neon jeomjeom deo
Bin teum eopshi jjayeojin seutoricheoreom

Heeojija geu hanmadiga janinhan geogetji
Ibeul yeoreodo dashi samkigo wae mot baetneungeoji

Neol sarangeun hajiman jogeum jichingeoya
Sangcheoreul jugiga neomu duryeoungeoya
Chakhan ge anya nal wihae geureongeoya
Ajikdo neol saranghandaneun geojitmal

Harue myeot beonsshik saenggakhaetji
Na eopshi neon eotteoke jinaelji
Jigiji mothal maneun yaksokdeul
Ijen uimi eopneun maldeullo namgetji

Heeojija geu hanmadiga janinhan geogetji
Ibeul yeoreodo dashi samkigo wae mot baetneungeoji

Neol sarangeun hajiman jogeum jichingeoya
Sangcheoreul jugiga neomu duryeoungeoya
Chakhan ge anya nal wihae geureongeoya
Ajikdo neol saranghandaneun geojitmal

Heeojijaneun geu hanmadireul wae mot baetneungeoji

Saranghaetjiman ije jichingeoya
Baby I need you to say something say something
Neodo aljana ije kkeuchingeoya
Baby I need you to say something say something

Saranghandaneun geojitmal

Saranghandaneun geojitmal

[Korean:]

널 사랑은 하지만 조금 지친거야
상처를 주기가 너무 두려운거야
착한 게 아냐 날 위해 그런거야
아직도 널 사랑한다는 거짓말

넌 답을 원했지 시작부터
결말을 미리 본 영화처럼
부담스러웠지 넌 점점 더
빈 틈 없이 짜여진 스토리처럼

헤어지자 그 한마디가 잔인한 거겠지
입을 열어도 다시 삼키고 왜 못 뱉는거지

널 사랑은 하지만 조금 지친거야
상처를 주기가 너무 두려운거야
착한 게 아냐 날 위해 그런거야
아직도 널 사랑한다는 거짓말

하루에 몇 번씩 생각했지
나 없이 넌 어떻게 지낼지
지키지 못할 많은 약속들
이젠 의미 없는 말들로 남겠지

헤어지자 그 한마디가 잔인한 거겠지
입을 열어도 다시 삼키고 왜 못 뱉는거지

널 사랑은 하지만 조금 지친거야
상처를 주기가 너무 두려운거야
착한 게 아냐 날 위해 그런거야
아직도 널 사랑한다는 거짓말

헤어지자는 그 한마디를 왜 못 뱉는거지

사랑했지만 이제 지친거야
Baby I need you to say something say something
너도 알잖아 이제 끝인거야
Baby I need you to say something say something

사랑한다는 거짓말

사랑한다는 거짓말

[English translation:]

I do love you but I'm a bit tired
I'm too scared to hurt you
I'm not being nice, I'm doing this for myself
This lie of saying I still love you

You wanted an answer from the start
Like already wanting to know the ending of a movie
So I felt pressured, more and more
Like a perfectly made-up story

Let's break up, those words are so cruel
I open my mouth but I swallow it back in, why can't I say it?

I do love you but I'm a bit tired
I'm too scared to hurt you
I'm not being nice, I'm doing this for myself
This lie of saying I still love you

I thought about this several times a day
How you would live without me
All the promises that won't be kept
They'll just remain as meaningless words

Let's break up, those words are so cruel
I open my mouth but I swallow it back in, why can't I say it?

I do love you but I'm a bit tired
I'm too scared to hurt you
I'm not being nice, I'm doing this for myself
This lie of saying I still love you

Why can't I say, let's break up

I loved you but now I'm tired
Baby I need you to say something say something
You know it's over too
Baby I need you to say something say something

This lie of saying I love you

This lie of saying I love you"
Whole Heart (Hold Me Now),Hillsong United,"Hold me now
In the hands that created the heavens
Find me now
Where the grace runs as deep as Your scars
You pulled me from the clay
You set me on a rock
Called me by Your Name
And made my heart whole again

Lifted up
And my knees know it's all for Your glory
I might stand
With more reasons to sing than to fear
You pulled me from the clay
Set me on a rock
Called me by Your Name
And made my heart whole again

So here I stand
High in surrender
I need You now
Hold my heart
Now and forever
My soul cries out

Once I was broken
But You loved my whole heart through
Sin has no hold on me
'Cause Your grace holds me now

And that grace
Owns the ground where the grave did
Where all my shame remains
Left for dead in Your wake
You crashed those age-old gates
You left no stone unturned
You stepped out of that grave
And shouldered me all the way

So here I stand
High in surrender
I need You now
Hold my heart
Now and forever
My soul cries out

Once I was broken
But You loved my whole heart through
Sin has no hold on me
'Cause Your grace holds me now

Healed and forgiven
Look where my chains are now
Death has no hold on me
'Cause Your grace holds that ground
And Your grace holds me now
Your grace holds me now
Your grace holds me now
Your grace holds me now

So here I stand
High in surrender
I need You now
Hold my heart
Now and forever
My soul cries out

So here I stand
High in surrender
I need You now
Hold my heart
Now and forever
My soul cries out

So here I stand
High in surrender
I need You now
Hold my heart
Now and forever
My soul cries out

So here I stand
High in surrender
I need You now
Hold my heart
Now and forever
My soul cries out

Once I was broken
But You loved my whole heart through
Sin has no hold on me
'Cause Your grace holds me now

Healed and forgiven
Look where my chains are now
Death has no hold on me
'Cause Your grace holds that ground
And Your grace holds me now
Your grace holds me now
Your grace holds me now
Your grace holds me now

Healed and forgiven
Look where my chains are now
Death has no hold on me
'Cause Your grace holds that ground
And Your grace holds me now
Your grace holds me now"
none,none,none
none,none,none
