title,arist,lyrics
So Will I (100 Billion X),Hillsong Worship,"God of creation
There at the start
Before the beginning of time
With no point of reference
You spoke to the dark
And fleshed out the wonder of light

And as You speak
A hundred billion galaxies are born
In the vapour of Your breath the planets form
If the stars were made to worship so will I
I can see Your heart in everything You've made
Every burning star
A signal fire of grace
If creation sings Your praises so will I

God of Your promise
You don't speak in vain
No syllable empty or void
For once You have spoken
All nature and science
Follow the sound of Your voice

And as You speak
A hundred billion creatures catch Your breath
Evolving in pursuit of what You said
If it all reveals Your nature so will I
I can see Your heart in everything You say
Every painted sky
A canvas of Your grace
If creation still obeys You so will I

If the stars were made to worship so will I
If the mountains bow in reverence so will I
If the oceans roar Your greatness so will I
For if everything exists to lift You high so will I
If the wind goes where You send it so will I
If the rocks cry out in silence so will I
If the sum of all our praises still falls shy
Then we'll sing again a hundred billion times

God of salvation
You chased down my heart
Through all of my failure and pride
On a hill You created
The light of the world
Abandoned in darkness to die

And as You speak
A hundred billion failures disappear
Where You lost Your life so I could find it here
If You left the grave behind You so will I
I can see Your heart in everything You've done
Every part designed in a work of art called love
If You gladly chose surrender so will I
I can see Your heart
Eight billion different ways
Every precious one
A child You died to save
If You gave Your life to love them so will I

Like You would again a hundred billion times
But what measure could amount to Your desire
You're the One who never leaves the one behind"
Did You Feel The Mountains Tremble,UPPERROOM,"Did you feel the mountains tremble?
Did you hear the oceans roar?
When the people rose to sing of
Jesus Christ, the Risen One

Did you feel the people tremble?
Did you hear the singers roar?
When the lost began to sing of
Jesus Christ, the Saving One

(We can sing that)
We can see that, God, You're moving
A mighty river through the nations
When young and old will turn to Jesus
Fling wide you heavenly gates
Prepare the way of the risen Lord

And open up the doors
And let the music play
Let the streets resound with singing
Songs that bring Your hope
Songs that bring Your joy, joy
Dancers who dance upon injustice

And do you feel the darkness tremble?
When all the saints join in one song
When all the streams flow as one river
To wash away our brokenness
(Oh, sing it out again)
Do you feel the darkness tremble?
When all the saints join in one song
And all the streams flow as one river
To wash away our brokenness

(And hear we see)
Hear we see that, God, You're moving
A time of jubilee is coming
When young and old return to Jesus
Fling wide you heavenly gates
Prepare the way of the risen Lord

So open up the doors
And let the music play
Let the streets resound with singing
Songs that bring Your hope
Songs that bring Your joy, joy
Dancers who dance upon injustice

So open up the doors
Let the music play
Let the streets resound with singing
It's songs that bring Your hope
Songs that bring Your joy, joy
Dancers who dance upon injustice

I put off all my heaviness and
I put on a garment of praise
I put off all my heaviness and
I put on a garment of praise
I put off all my heaviness and
I put on a garment of praise
I put off all my heaviness and
I put on a garment of praise
(Sing that again)
I put off all my heaviness and
I put on a garment of praise
'Cause You turned my mourning into dancing
You turned my night into day
I put off all my heaviness and
I put on a garment of praise
You turned my mourning into dancing
You turned my night into day
I put off all my heaviness

I put off all my heaviness and
I put on a garment of praise
Oh, I'm gonna praise You, I'm gonna praise You
I'm gonna praise You, I'm gonna praise You
I'm gonna rejoice in this day You made
I'm gonna rejoice in this day You made
I'm gonna rejoice in this day You made
I'm gonna rejoice in this day You made
I'm gonna rejoice
I'm gonna rejoice
Oh, I'm gonna rejoice in this day You made
I'm gonna rejoice in this day You made
I'm gonna rejoice in this day You made
We praise Your name
I'm gonna rejoice in this day You made
I'm gonna rejoice in this day You made
Oh, I'm gonna rejoice in Your presence

'Cause I've got the joy, joy, joy, joy down in my heart
I've got the joy, joy, joy, joy down in my heart
I've got the joy, joy, joy, joy down in my heart to stay, to stay
I've got the joy, joy, joy, joy down in my heart
I've got the joy, joy, joy, joy down in my heart
I've got the joy, joy, joy, joy down in my heart to stay
I've got the joy, joy, joy, joy down in my heart
I've got the joy, joy, joy, joy down in my heart
I've got the joy, joy, joy, joy down in my heart to stay
Thank You, Jesus
I've got the joy, joy, joy, joy down in my heart
I've got the joy, joy, joy, joy down in my heart
I've got the joy, joy, joy, joy down in my heart to stay

So open up the doors
And let the music play
Let the streets resound with singing
'Cause it's songs that bring Your hope
Songs that bring Your joy
Dancers who dance upon injustice
(Sing that again)
Oh, open up the doors
And let the music play
Let the streets resound with singing
It's songs that bring Your hope
Songs that bring Your joy
Dancers who dance upon injustice
(Sing it one more time, open up)
Oh, open up the doors
And let the music play
Let the streets resound with singing
Songs that bring Your joy
Songs that bring Your joy
Dancers who dance upon injustice

Oh, we worship You
We honor You tonight
We honor You, we honor You, we honor You tonight"
Another In The Fire,Hillsong United,"There's a grace when the heart is under fire
Another way when the walls are closing in
And when I look at the space between
Where I used to be and this reckoning
I know I will never be alone

There was another in the fire
Standing next to me
There was another in the waters
Holding back the seas
And should I ever need reminding
Of how I've been set free
There is a cross that bears the burden
Where another died for me

There is another in the fire

All my debt left for dead beneath the waters
I'm no longer a slave to my sin anymore
And should I fall in the space between
What remains of me and this reckoning
Either way I won't bow to the things of this world

'Cause I know

And I know I will never be alone

There is another in the fire
Standing next to me
There is another in the waters
Holding back the seas
And should I ever need reminding
What power set me free
There is a grave that holds no body
And now that power lives in me

There is another in the fire
There is another in the fire
There is another in the fire
There is another in the fire

I can see

And I can see the light in the darkness
As the darkness bows to Him
I can hear the roar in the heavens
As the space between wears thin

I can feel the ground shake beneath us
As the prison walls cave in
Nothing stands between us
Nothing stands between us

And there is no other name
But the name that is Jesus
He who was and still is
And will be through it all
So come what may in the space between
All the things unseen
And this reckoning
I know I will never be alone

I know. Come on
I know I will never be alone

There'll be another in the fire
Standing next to me
There'll be another in the waters
Holding back the seas
And should I ever need reminding
How good You've been to me
I'll count the joy come every battle
'Cause I know that's where You'll be

I can see the light

And I can see the light in the darkness
As the darkness bows to Him
I can hear the roar in the heavens
As the space between wears thin

I can feel the ground shake beneath us
As the prison walls cave in
Nothing stands between us
Nothing stands between

There'll be another in the fire
Standing next to me
There'll be another in the waters
Holding back the seas
And should I ever need reminding
How good You've been to me
I'll count the joy come every battle
'Cause I know that's where You'll be

Count the joy come every battle
'Cause I know that's where You'll be
Count the joy come every battle
'Cause I know that's where You'll be

Sing it again

I'll count the joy come every battle
'Cause I know that's where You'll be
I'll count the joy come every battle
'Cause I know that's where You'll be"
Best Part,Joseph Vincent,"You don't know babe
When you hold me
And kiss me slowly
It's the sweetest thing
And it don't change
If I had it my way
You would know that you are

You're the coffee that I need in the morning
You're my sunshine in the rain when it's pouring
Won't you give yourself to me
Give it all

I just wanna see, yeah
I just wanna see how beautiful you are
You know that I see it
I know you're a star
Where you go I follow
No matter how far
If life is a movie
Oh you're the best part, ohh
You're the best part, ohh
Best part

It's the sunrise
And those brown eyes
You're the one that I desire
When we wake up
And then we make love
It makes me feel so nice

You're my water when I'm stuck in the desert
You're my Tylenol I take when my head hurts
You're the sunshine on my life

I just wanna see how beautiful you are
You know that I see it
I know you're a star
Where you go I follow
No matter how far
If life is a movie
Ohh, you're the best part
Ohh, you're the best part
Ohh, best part"
Do It Again (Acoustic),Elevation Worship,"Walking around these walls
I thought by now they'd fall
But You have never failed me yet

Waiting for change to come
Knowing the battle's won
For You have never failed me yet

Your promise still stands
Great is Your faithfulness, faithfulness
I'm still in Your hands
This is my confidence, You've never failed me yet

I know the night won't last
Your Word will come to pass
My heart will sing Your praise again

Jesus You're still enough
Keep me within Your love
My heart will sing Your praise again

Your promise still stands
Great is Your faithfulness, faithfulness
I'm still in Your hands
This is my confidence, You never failed

Your promise still stands
Great is Your faithfulness, faithfulness
I'm still in Your hands
This is my confidence, You never failed me yet

I've seen You move... come move the mountains
And I believe... I'll see You do it again
You made a way... where there was no way
And I believe... I'll see You do it again

I've seen You move... come move the mountains
And I believe... I'll see You do it again
You made a way... where there was no way
And I believe... I'll see You do it again

I've seen You move... come move the mountains
And I believe... I'll see You do it again
You made a way... where there was no way
And I believe... I'll see You do it again
I'll see You do it again...

Your promise still stands
Great is Your faithfulness, faithfulness
I'm still in Your hands
This is my confidence, You never failed

Your promise still stands
Great is Your faithfulness, faithfulness
I'm still in Your hands
This is my confidence, You never failed me yet

Oh You never failed me yet
I never will forget
'Cause You never failed me yet
I never will forget..."
New Balance (Rough),Jhene Aiko,"Most of us are angry
Most of us are strangely
More alike than we'd like to believe
Most of us are empty
Most of us are simply
More alive in the scenes of our dreams

Then there's you
You've got something I've been wanting, oooh
You're so new
Oooh
You're my salvage, you're my balance, oooh
You're so new

Most of us are hurting
Most of us are searching
Someone to love
Someone to understand
Most the time I'm fighting
Multiple voices residing
In my head

Then there's you
You bring silence to my violent truth
Yes you do
Oooh
You're my salvage, you're my balance, oooh
You're so new

It hit me like a tidal wave
Knew that I was in love with you right away, yeah
Turned all my days into brighter days
Even when people say what we do is not okay
According to what the people say, yeah
Who cares what other people say?
Man fuck what other people say
I'ma ride for you
Baby, if you gon' ride for me
Cause I know, yes I know
That what we have is oh so real
And oh I feel so confident in
All you say
When you say
You'll never leave
You'll never leave
Please never leave
Yeah, I believe you
Yeah I do

Most of all I am thankful
You are just what I prayed for
You are what I was made for
Yes, I'm for sure
Most of all
I just want to mean the most to you
Most of all, baby, I'm just tryna grow with you
I just wanna go with you
Cause you bring so much hope to the picture
Some of us do find the one
To fall in love
And off of the
Fucking face of the Earth with
Some of us do deserve it
A love that's true and perfect
Some of us been through it all before
Some of us do still come back for more"
No Me Deja Ir (Love Won't Give Up),Elevation Worship,"Nada fuera de tu amor satisface
Ningún error que de ti me separe
No se acaba mi esperanza
Eres fiel Tú, eres fiel Dios

La cruz es mi confianza de vivir
Tu amor no me deja ir
Tú cúmpliras cada promesa en mi
Tu amor no me deja ir

Me llamas de nuevo a donde me encontraste
Aunque me perdí nunca me abandonaste
No se acaba mi esperanza
Eres fiel Tú, eres fiel Dios

La cruz es mi confianza de vivir
Tu amor no me deja ir
Tú cúmpliras cada promesa en mi
Tu amor no me deja ir
Tu amor no me deja ir

No importa donde yo voy
Me encuentro en tu amor
Cuando angustiado estoy
No me soltarás
No importa donde yo voy
Me encuentro en tu amor
Cuando angustiado estoy
No me soltarás
No importa donde yo voy
Me encuentro en tu amor
Cuando angustiado estoy
No me soltarás
No importa donde yo voy
Me encuentro en tu amor
Cuando angustiado estoy
No me soltarás

La cruz es mi confianza de vivir
Tu amor no me deja ir
Tú cúmpliras cada promesa en mi
Tu amor no me deja ir
La cruz es mi confianza de vivir
Tu amor no me deja ir
Tú cúmpliras cada promesa en mi
Tu amor no me deja ir
Tu amor no me deja ir"
Say The Word,Hillsong United,"Say the word and there is light
Say the word and dead bones rise
Every start and end hangs on Your voice
For Your word never returns void

Written in a billion skies
Speaking to this heart of mine
All that I am with all creation
Hanging on every word that You've spoken
And it will not be shaken
Clinging for life to all Your promise
Hanging on every word that You say

It will remain
And my soul will hang on every word You say

Word made flesh You wrote in grace
Promise kept through cross and grave
Over words of stone You spelled out love
And when You say it is done
It is done

[2x]
Written in a billion skies
Speaking to this heart of mine
All that I am with all creation
Hanging on every word that You've spoken
And it will not be shaken
Clinging for life to all Your promise
Hanging on every word that You say

It will remain
And my soul will hang on every word You say
Cause I know Your word will never ever fail
And my soul will hang on every word You say"
You Say,Anthem Lights,"I keep fighting voices in my mind that say I'm not enough
Every single lie that tells me I will never measure up
Am I more than just the sum of every high and every low?
Remind me once again just who I am because I need to know

You say I am loved when I can't feel a thing
You say I am strong when I think I am weak
And You say I am held when I am falling short
And when I don't belong, oh You say I am Yours
And I believe, oh I believe
What You say of me
I believe

The only thing that matters now is everything You think of me
In You I find my worth, in You I find my identity, o-ooh

You say I am loved when I can't feel a thing
You say I am strong when I think I am weak
And You say I am held when I am falling short
And when I don't belong, oh You say I am Yours
And I believe, oh I believe
What You say of me
Oh, I believe

Taking all I have and now I'm laying it at Your feet
You have every failure God, and You'll have every victory, o-ooh

You say I am loved when I can't feel a thing
You say I am strong when I think I am weak
You say I am held when I am falling short
When I don't belong, oh You say I am Yours
And I believe, oh I believe
What You say of me
I believe"
